{"schema_version":"gocode.rc0.platform-qualified-subject/2","repository_id":"gocode","project_owner_authority_receipt_sha256":"aaaaaaaaaaaaaaaaaaaaaaaaaaaaaaaaaaaaaaaaaaaaaaaaaaaaaaaaaaaaaaaa","mapping_policy_envelope_sha256":"2222222222222222222222222222222222222222222222222222222222222222","active_activation_snapshot_envelope_sha256":"4444444444444444444444444444444444444444444444444444444444444444","platform_qualified_subject_envelope_sha256":"5555555555555555555555555555555555555555555555555555555555555555","runtime_adr_document_sha256":"dddddddddddddddddddddddddddddddddddddddddddddddddddddddddddddddd","desktop_adr_document_sha256":"eeeeeeeeeeeeeeeeeeeeeeeeeeeeeeeeeeeeeeeeeeeeeeeeeeeeeeeeeeeeeeee"}
